anime_id,mal_id,title,english_title,user_preferred_title,cover_image_large
176496,58567.0,Ore dake Level Up na Ken: Season 2 - Arise from the Shadow,Solo Leveling Season 2 -Arise from the Shadow-,Ore dake Level Up na Ken: Season 2 - Arise from the Shadow,https://s4.anilist.co/file/anilistcdn/media/anime/cover/medium/bx176496-0bL8sVAsYEfz.png
177709,58939.0,SAKAMOTO DAYS,SAKAMOTO DAYS,SAKAMOTO DAYS,https://s4.anilist.co/file/anilistcdn/media/anime/cover/medium/bx177709-e5Qx6RlsBgD5.png
176301,58514.0,Kusuriya no Hitorigoto 2nd Season,The Apothecary Diaries Season 2,Kusuriya no Hitorigoto 2nd Season,https://s4.anilist.co/file/anilistcdn/media/anime/cover/medium/bx176301-i9VeW2opQHHW.jpg
172019,57592.0,Dr. STONE: SCIENCE FUTURE,Dr. STONE SCIENCE FUTURE,Dr. STONE: SCIENCE FUTURE,https://s4.anilist.co/file/anilistcdn/media/anime/cover/medium/bx172019-3cfZbrYBmV23.jpg
172258,57616.0,Kimi no Koto ga Dai Dai Dai Dai Daisuki na 100-nin no Kanojo 2nd Season,"The 100 Girlfriends Who Really, Really, Really, Really, REALLY Love You Season 2",Kimi no Koto ga Dai Dai Dai Dai Daisuki na 100-nin no Kanojo 2nd Season,https://s4.anilist.co/file/anilistcdn/media/anime/cover/medium/bx172258-n23TSWk54aXv.jpg
176273,58502.0,Zenshuu.,ZENSHU,Zenshuu.,https://s4.anilist.co/file/anilistcdn/media/anime/cover/medium/bx176273-raxxcgkslf4Q.jpg
178462,59135.0,Class no Daikirai na Joshi to Kekkon Suru Koto ni Natta.,I'm Getting Married to a Girl I Hate in My Class,Class no Daikirai na Joshi to Kekkon Suru Koto ni Natta.,https://s4.anilist.co/file/anilistcdn/media/anime/cover/medium/bx178462-YW6BgSGGP4az.jpg
167143,55997.0,"Guild no Uketsukejou desu ga, Zangyou wa Iya nanode Boss wo Solo Toubatsu Shiyou to Omoimasu","I May Be a Guild Receptionist, but I’ll Solo Any Boss to Clock Out on Time","Guild no Uketsukejou desu ga, Zangyou wa Iya nanode Boss wo Solo Toubatsu Shiyou to Omoimasu",https://s4.anilist.co/file/anilistcdn/media/anime/cover/medium/bx167143-iY2ho0I0KnYF.jpg
175443,58271.0,Honey Lemon Soda,Honey Lemon Soda,Honey Lemon Soda,https://s4.anilist.co/file/anilistcdn/media/anime/cover/medium/bx175443-QpmlCJt47Rp9.jpg
169441,56701.0,Watashi no Shiawase na Kekkon 2nd Season,My Happy Marriage Season 2,Watashi no Shiawase na Kekkon 2nd Season,https://s4.anilist.co/file/anilistcdn/media/anime/cover/medium/bx169441-DHutDkhkC8EN.jpg
178548,59144.0,Fuguushoku [Kanteishi] ga Jitsu wa Saikyou Datta: Naraku de Kitaeta Saikyou no [Shingan] de Musou Suru,"Even Given the Worthless “Appraiser” Class, I’m Actually the Strongest",Fuguushoku [Kanteishi] ga Jitsu wa Saikyou Datta: Naraku de Kitaeta Saikyou no [Shingan] de Musou Suru,https://s4.anilist.co/file/anilistcdn/media/anime/cover/medium/bx178548-4QkzBuJAx8w7.jpg
179696,59361.0,Kono Kaisha ni Suki na Hito ga Imasu,I Have a Crush at Work,Kono Kaisha ni Suki na Hito ga Imasu,https://s4.anilist.co/file/anilistcdn/media/anime/cover/medium/bx179696-1MAqXYVXT7IT.jpg
177506,58822.0,Izure Saikyou no Renkinjutsushi?,Possibly the Greatest Alchemist of All Time,Izure Saikyou no Renkinjutsushi?,https://s4.anilist.co/file/anilistcdn/media/anime/cover/medium/bx177506-in4J0GNzjOZL.jpg
177552,58853.0,Kuroiwa Medaka ni Watashi no Kawaii ga Tsuujinai,Medaka Kuroiwa is Impervious to My Charms,Kuroiwa Medaka ni Watashi no Kawaii ga Tsuujinai,https://s4.anilist.co/file/anilistcdn/media/anime/cover/medium/bx177552-7XiOf3dGXmNs.jpg
180812,59730.0,"A-Rank Party wo Ridatsu Shita Ore wa, Moto Oshiegotachi to Meikyuu Shinbu wo Mezasu.",I Left My A-Rank Party to Help My Former Students Reach the Dungeon Depths!,"A-Rank Party wo Ridatsu Shita Ore wa, Moto Oshiegotachi to Meikyuu Shinbu wo Mezasu.",https://s4.anilist.co/file/anilistcdn/media/anime/cover/medium/bx180812-162w2RBaqJzE.jpg
179689,59349.0,Salaryman ga Isekai ni Ittara Shitennou ni Natta Hanashi,Headhunted to Another World: From Salaryman to Big Four!,Salaryman ga Isekai ni Ittara Shitennou ni Natta Hanashi,https://s4.anilist.co/file/anilistcdn/media/anime/cover/medium/bx179689-kmlqdU3IbxeM.jpg
176642,58600.0,Ameku Takao no Suiri Karte,Ameku M.D.: Doctor Detective,Ameku Takao no Suiri Karte,https://s4.anilist.co/file/anilistcdn/media/anime/cover/medium/bx176642-MQvtKB0WJZGf.png
178100,59002.0,Hazure Skill «Kinomi Master»: Skill no Mi (Tabetara Shinu) wo Mugen ni Taberareru You ni Natta Ken Nitsuite,Bogus Skill <<Fruitmaster>> ~About that time I became able to eat unlimited numbers of Skill Fruits (that kill you)~,Hazure Skill «Kinomi Master»: Skill no Mi (Tabetara Shinu) wo Mugen ni Taberareru You ni Natta Ken Nitsuite,https://s4.anilist.co/file/anilistcdn/media/anime/cover/medium/bx178100-GF4dKSrkdByJ.jpg
180292,59561.0,Arafou Otoko no Isekai Tsuuhan Seikatsu,The Daily Life of a Middle-Aged Online Shopper in Another World,Arafou Otoko no Isekai Tsuuhan Seikatsu,https://s4.anilist.co/file/anilistcdn/media/anime/cover/medium/bx180292-GG0nwYZ5HeN7.jpg
172439,57648.0,Nihon e Youkoso Elf-san.,"Welcome to Japan, Ms. Elf!",Nihon e Youkoso Elf-san.,https://s4.anilist.co/file/anilistcdn/media/anime/cover/medium/bx172439-sTda7baXB0Fh.jpg
170892,53924.0,Jibaku Shounen Hanako-kun 2,Toilet-bound Hanako-kun Season 2,Jibaku Shounen Hanako-kun 2,https://s4.anilist.co/file/anilistcdn/media/anime/cover/medium/bx170892-zhJUSsX6PaF0.jpg
165171,55318.0,Medalist,Medalist,Medalist,https://s4.anilist.co/file/anilistcdn/media/anime/cover/medium/bx165171-an9pyRXwVxJS.jpg
172453,57719.0,Akuyaku Reijou Tensei Oji-san,From Bureaucrat to Villainess: Dad's Been Reincarnated!,Akuyaku Reijou Tensei Oji-san,https://s4.anilist.co/file/anilistcdn/media/anime/cover/medium/bx172453-7iYNTAEZpNsJ.png
176063,58437.0,"Botsuraku Yotei no Kizoku dakedo, Hima Datta kara Mahou wo Kiwamete mita","I’m a Noble on the Brink of Ruin, So I Might as Well Try Mastering Magic","Botsuraku Yotei no Kizoku dakedo, Hima Datta kara Mahou wo Kiwamete mita",https://s4.anilist.co/file/anilistcdn/media/anime/cover/medium/bx176063-dIL2xrjmOLs1.jpg
179297,59265.0,Magic Maker: Isekai Mahou no Tsukurikata,Magic Maker: How to Make Magic in Another World,Magic Maker: Isekai Mahou no Tsukurikata,https://s4.anilist.co/file/anilistcdn/media/anime/cover/medium/bx179297-qaG8nCqMpR3o.jpg
176158,58473.0,"S-Rank Monster no ""Behemoth"" Dakedo, Neko to Machigawarete Elf Musume no Pet to Shite Kurashitemasu",Beheneko: The Elf-Girl's Cat is Secretly an S-Ranked Monster!,"S-Rank Monster no ""Behemoth"" Dakedo, Neko to Machigawarete Elf Musume no Pet to Shite Kurashitemasu",https://s4.anilist.co/file/anilistcdn/media/anime/cover/medium/bx176158-nQ6EtQp76q6d.jpg
175198,58216.0,Übel Blatt,Übel Blatt,Übel Blatt,https://s4.anilist.co/file/anilistcdn/media/anime/cover/medium/bx175198-AtWwEQPTjQ6N.jpg
166699,55842.0,Okinawa de Suki ni Natta Ko ga Hougen Sugite Tsura Sugiru,"OKITSURA: Fell in Love with an Okinawan Girl, but I Just Wish I Know What She's Saying",Okinawa de Suki ni Natta Ko ga Hougen Sugite Tsura Sugiru,https://s4.anilist.co/file/anilistcdn/media/anime/cover/medium/bx166699-k5hIccoA5XSW.jpg
180052,59514.0,Sentai Red Isekai de Boukensha ni Naru,The Red Ranger Becomes an Adventurer in Another World,Sentai Red Isekai de Boukensha ni Naru,https://s4.anilist.co/file/anilistcdn/media/anime/cover/medium/bx180052-i29SxOyEBtXB.jpg
185880,59226.0,Ao no Exorcist: Yosuga-hen,Blue Exorcist -The Blue Night Saga-,Ao no Exorcist: Yosuga-hen,https://s4.anilist.co/file/anilistcdn/media/anime/cover/medium/bx185880-efBIcDBzPiHP.jpg
174654,58082.0,NEET Kunoichi to Naze ka Dousei Hajimemashita,I'm Living With a Otaku NEET Kunoichi?!,NEET Kunoichi to Naze ka Dousei Hajimemashita,https://s4.anilist.co/file/anilistcdn/media/anime/cover/medium/bx174654-J8OduNFjRpVY.jpg
179998,59489.0,Kaijuu 8-gou Movie,Kaiju No. 8: Mission Recon,Kaijuu 8-gou Movie,https://s4.anilist.co/file/anilistcdn/media/anime/cover/medium/bx179998-2QNb7f6oXGUI.jpg
136381,49363.0,SK∞ Extra Part,SK8 the Infinity EXTRA PART,SK∞ Extra Part,https://s4.anilist.co/file/anilistcdn/media/anime/cover/medium/bx136381-t6c5rfKjnqqd.jpg
179999,59490.0,Kaijuu 8-gou: Hoshina no Kyuujitsu,Kaiju No.8: Hoshina's Day Off,Kaijuu 8-gou: Hoshina no Kyuujitsu,https://s4.anilist.co/file/anilistcdn/media/anime/cover/medium/bx179999-8FuSR5TlOCD1.jpg
178550,59142.0,Unnamed Memory Act.2,Unnamed Memory Season 2,Unnamed Memory Act.2,https://s4.anilist.co/file/anilistcdn/media/anime/cover/medium/bx178550-1mjYHtOwiqkC.jpg
178022,59055.0,"Hana wa Saku, Shura no Gotoku",Flower and Asura,"Hana wa Saku, Shura no Gotoku",https://s4.anilist.co/file/anilistcdn/media/anime/cover/medium/bx178022-gB3zAfazGBJ6.jpg
179878,59419.0,Project Sekai: Kowareta SEKAI to Utaenai MIKU,COLORFUL STAGE! The Movie: A Miku Who Can't Sing,Project Sekai: Kowareta SEKAI to Utaenai MIKU,https://s4.anilist.co/file/anilistcdn/media/anime/cover/medium/bx179878-jG5GTXhe2vou.jpg
169295,56653.0,BanG Dream! Ave Mujica,Ave Mujica - The Die is Cast -,BanG Dream! Ave Mujica,https://s4.anilist.co/file/anilistcdn/media/anime/cover/medium/bx169295-r5GrXXAQUSOI.png
175409,58259.0,"Douse, Koishite Shimaunda.","Anyway, I'm Falling in Love with You.","Douse, Koishite Shimaunda.",https://s4.anilist.co/file/anilistcdn/media/anime/cover/medium/bx175409-ZYYEw0H6QypN.jpg
176234,58484.0,Ishura 2nd Season,ISHURA Season 2,Ishura 2nd Season,https://s4.anilist.co/file/anilistcdn/media/anime/cover/medium/bx176234-Wx2rAYr7YSD8.jpg
170650,57050.0,Kisaki Kyouiku kara Nigetai Watashi,I Want to Escape from Princess Lessons,Kisaki Kyouiku kara Nigetai Watashi,https://s4.anilist.co/file/anilistcdn/media/anime/cover/medium/bx170650-iVQC67atMVj3.png
170916,57152.0,Mahoutsukai no Yakusoku,Promise of Wizard,Mahoutsukai no Yakusoku,https://s4.anilist.co/file/anilistcdn/media/anime/cover/medium/bx170916-B6VKOdSOBccU.jpg
145740,51119.0,Grisaia: Phantom Trigger,Grisaia: Phantom Trigger,Grisaia: Phantom Trigger,https://s4.anilist.co/file/anilistcdn/media/anime/cover/medium/bx145740-KtUZ6O59DaDq.jpg
177159,58739.0,Momentary Lily,Momentary Lily,Momentary Lily,https://s4.anilist.co/file/anilistcdn/media/anime/cover/medium/bx177159-Yt7VNCVjlnxR.jpg
178495,59136.0,Tasokare Hotel,TASOKARE HOTEL,Tasokare Hotel,https://s4.anilist.co/file/anilistcdn/media/anime/cover/medium/bx178495-RJCGa2YRdKBU.jpg
174596,58066.0,Sora-iro Utility (TV),Sorairo Utility (TV),Sora-iro Utility (TV),https://s4.anilist.co/file/anilistcdn/media/anime/cover/medium/bx174596-GbgKrUtBBuIg.jpg
154392,52967.0,Versailles no Bara Movie,The Rose of Versailles,Versailles no Bara Movie,https://s4.anilist.co/file/anilistcdn/media/anime/cover/medium/bx154392-I35rrWRu9KlY.jpg
154064,54740.0,MAKE A GIRL,,MAKE A GIRL,https://s4.anilist.co/file/anilistcdn/media/anime/cover/medium/bx154064-qYnRF4BQsuM6.png
182158,59957.0,Senpai wa Otokonoko: Ame Nochi Hare,Senpai is an Otokonoko Movie: Sunshine After the Rain,Senpai wa Otokonoko: Ame Nochi Hare,https://s4.anilist.co/file/anilistcdn/media/anime/cover/medium/bx182158-ztLTD2FKPnrd.jpg
179852,59408.0,Mononoke: Hinezumi,Mononoke The Movie: Chapter II - The Ashes of Rage,Mononoke: Hinezumi,https://s4.anilist.co/file/anilistcdn/media/anime/cover/medium/bx179852-tPwGOkCxA8em.jpg
178312,59113.0,FARMAGIA,Farmagia,FARMAGIA,https://s4.anilist.co/file/anilistcdn/media/anime/cover/medium/bx178312-iGhE7xvvCReS.jpg
175422,58265.0,Baban Baban Ban Vampire,Babanba Banban Vampire,Baban Baban Ban Vampire,https://s4.anilist.co/file/anilistcdn/media/anime/cover/medium/bx175422-4I9gEsW7px6C.png
185073,60407.0,Kimi to Idol Precure♪,You and Idol Precure ♪,Kimi to Idol Precure♪,https://s4.anilist.co/file/anilistcdn/media/anime/cover/medium/bx185073-ilizz2Jd9223.png
181440,59843.0,Aldnoah.Zero: Ame no Danshou - The Penultimate Truth,ALDNOAH.ZERO: The Penultimate Truth,Aldnoah.Zero: Ame no Danshou - The Penultimate Truth,https://s4.anilist.co/file/anilistcdn/media/anime/cover/medium/bx181440-YfrrFmLHwFBR.jpg
177778,58964.0,Ninja Batman vs. Yakuza League,Batman Ninja vs. Yakuza League,Ninja Batman vs. Yakuza League,https://s4.anilist.co/file/anilistcdn/media/anime/cover/medium/bx177778-LF9pwTXJRY0R.jpg
187225,,LOS ANGELES LAKERS x ONE PIECE,,LOS ANGELES LAKERS x ONE PIECE,https://s4.anilist.co/file/anilistcdn/media/anime/cover/medium/bx187225-H0ppAOkOYMxM.jpg
185714,60666.0,Aldnoah.Zero (Re+),,Aldnoah.Zero (Re+),https://s4.anilist.co/file/anilistcdn/media/anime/cover/medium/bx185714-YYhn41FIOfmM.jpg
162722,54717.0,Mahoutsukai Precure!! MIRAI DAYS,Witchy Precure!! ~MIRAI DAYS~,Mahoutsukai Precure!! MIRAI DAYS,https://s4.anilist.co/file/anilistcdn/media/anime/cover/medium/bx162722-w30E3QgBvG7H.jpg
185261,60662.0,Neko ni Naritai Tamagawa-kun,,Neko ni Naritai Tamagawa-kun,https://s4.anilist.co/file/anilistcdn/media/anime/cover/medium/bx185261-hJehR0xUg9cf.jpg
162921,54769.0,Sousei no Aquarion: Myth of Emotions,AQUARION: Myth of Emotions,Sousei no Aquarion: Myth of Emotions,https://s4.anilist.co/file/anilistcdn/media/anime/cover/medium/bx162921-ByoCP2VvLjeT.jpg
194403,60645.0,Boku no Hero Academia THE MOVIE: YOU'RE NEXT - A PIECE OF CAKE,,Boku no Hero Academia THE MOVIE: YOU'RE NEXT - A PIECE OF CAKE,https://s4.anilist.co/file/anilistcdn/media/anime/cover/medium/bx194403-kOJa1pMt3tjk.jpg
186559,60946.0,Kairyuu to Yuubinya-san,,Kairyuu to Yuubinya-san,https://s4.anilist.co/file/anilistcdn/media/anime/cover/medium/bx186559-yoHyJ6ROfrxT.jpg
186148,60749.0,Maomao no Hitorigoto 2nd Season,,Maomao no Hitorigoto 2nd Season,https://s4.anilist.co/file/anilistcdn/media/anime/cover/medium/b186148-Tx8InzoohmXs.png
167742,56135.0,UniteUp!: Uni:Birth,UniteUp! -Uni:Birth-,UniteUp!: Uni:Birth,https://s4.anilist.co/file/anilistcdn/media/anime/cover/medium/bx167742-fFAj38cj7Wxo.png
185992,61271.0,NEET Kunoichi to Naze ka Dousei Hajimemashita OVAs,,NEET Kunoichi to Naze ka Dousei Hajimemashita OVAs,https://s4.anilist.co/file/anilistcdn/media/anime/cover/medium/bx185992-HL0It4J2Vn41.png
187236,60987.0,Princess Connect! Michibiki no Hatsuhana: Fiore Storia,,Princess Connect! Michibiki no Hatsuhana: Fiore Storia,https://s4.anilist.co/file/anilistcdn/media/anime/cover/medium/bx187236-tFSyyAliXxLH.jpg
189160,61334.0,"Momentary Lily: Tsuzuite iku Kappou, Kappou!",Momentary Lily: Kappou On and On,"Momentary Lily: Tsuzuite iku Kappou, Kappou!",https://s4.anilist.co/file/anilistcdn/media/anime/cover/medium/bx189160-JInwvQpGhkjT.jpg
185088,60410.0,Yami Shibai 14,Theatre of Darkness: Yamishibai 14,Yami Shibai 14,https://s4.anilist.co/file/anilistcdn/media/anime/cover/medium/bx185088-pY2KxbG0KIoO.jpg
185506,60553.0,Nonohara Yuka no Himitsu no Haishin,,Nonohara Yuka no Himitsu no Haishin,https://s4.anilist.co/file/anilistcdn/media/anime/cover/medium/bx185506-e6BT2M2TFz3i.png
179333,60629.0,"""1-punkan dake Furete mo Ii yo…"" Share House no Himitsu Rule.	",The Share House's Secret Rule,"""1-punkan dake Furete mo Ii yo…"" Share House no Himitsu Rule.	",https://s4.anilist.co/file/anilistcdn/media/anime/cover/medium/bx179333-BsQOchil1Q9g.png
185462,60425.0,0-saiji Start Dash Monogatari Season 2,HEAD START AT BIRTH - Season 2,0-saiji Start Dash Monogatari Season 2,https://s4.anilist.co/file/anilistcdn/media/anime/cover/medium/b185462-63GUMNU2RGUd.jpg
181886,59914.0,Kinnikuman: Kanpeki Choujin Shiso-hen Season 2,Kinnikuman Perfect Origin Arc Season 2,Kinnikuman: Kanpeki Choujin Shiso-hen Season 2,https://s4.anilist.co/file/anilistcdn/media/anime/cover/medium/bx181886-gEqtKp6Wt2U2.jpg
183602,60216.0,Kanojo Face THE ANIMATION,,Kanojo Face THE ANIMATION,https://s4.anilist.co/file/anilistcdn/media/anime/cover/medium/bx183602-8yGvSxmilgjW.png
184810,60494.0,Immoral Routine The Animation,,Immoral Routine The Animation,https://s4.anilist.co/file/anilistcdn/media/anime/cover/medium/bx184810-BJhp0LMwWKpP.png
183741,60470.0,Nikuen,,Nikuen,https://s4.anilist.co/file/anilistcdn/media/anime/cover/medium/bx183741-eW11ec61Vg0T.png
186153,60784.0,Yuugao,,Yuugao,https://s4.anilist.co/file/anilistcdn/media/anime/cover/medium/bx186153-j5G9lBw43N69.png
185001,60390.0,Shiranai Koto Shiritai no? The Animation,,Shiranai Koto Shiritai no? The Animation,https://s4.anilist.co/file/anilistcdn/media/anime/cover/medium/bx185001-ueqGXlmN8iVe.png
182920,54144.0,Cardfight!! Vanguard: Divinez - Deluxe-hen,CARDFIGHT!! VANGUARD Divinez DELUXE Arc,Cardfight!! Vanguard: Divinez - Deluxe-hen,https://s4.anilist.co/file/anilistcdn/media/anime/cover/medium/bx182920-kGMtP4dBBJBO.jpg
183743,60495.0,"Kan'ochi x Netorare Kazoku The Animation: Anata, Yurushite. Watakushitachi, Uwaki Sex ni Honki de Hamacchatta no",,"Kan'ochi x Netorare Kazoku The Animation: Anata, Yurushite. Watakushitachi, Uwaki Sex ni Honki de Hamacchatta no",https://s4.anilist.co/file/anilistcdn/media/anime/cover/medium/bx183743-PWnF3dcpsu9M.png
187380,60790.0,"ONE PIECE: Original Episode/Luffy, Law",,"ONE PIECE: Original Episode/Luffy, Law",https://s4.anilist.co/file/anilistcdn/media/anime/cover/medium/bx187380-RZmxpJyB3A6Y.jpg
179838,59406.0,Binan Koukou Chikyuu Bouei-bu ETERNAL LOVE!,,Binan Koukou Chikyuu Bouei-bu ETERNAL LOVE!,https://s4.anilist.co/file/anilistcdn/media/anime/cover/medium/bx179838-qCOaqbhZ8eFX.jpg
183742,60720.0,Ajin ga Osuki nan desu ne♡,,Ajin ga Osuki nan desu ne♡,https://s4.anilist.co/file/anilistcdn/media/anime/cover/medium/bx183742-WOUbrnj69mhF.png
186300,60480.0,minute! kaiju no. 8,minute! Kaiju No. 8,minute! kaiju no. 8,https://s4.anilist.co/file/anilistcdn/media/anime/cover/medium/b186300-py8AeW9MgfDS.jpg
187305,60273.0,Hypnosis Mic -Division Rap Battle- Movie,,Hypnosis Mic -Division Rap Battle- Movie,https://s4.anilist.co/file/anilistcdn/media/anime/cover/medium/bx187305-Mzyh5PICkk9X.jpg
182333,59980.0,Doraemon: Nobita no E Sekai Monogatari,,Doraemon: Nobita no E Sekai Monogatari,https://s4.anilist.co/file/anilistcdn/media/anime/cover/medium/bx182333-t7cPjoPHHPBp.png
184765,60351.0,Iku Iku ♡ Succubus Saikyouiku,,Iku Iku ♡ Succubus Saikyouiku,https://s4.anilist.co/file/anilistcdn/media/anime/cover/medium/bx184765-bnevwOoXSFur.png
182877,60094.0,Kankin Kuiki Level X 2nd Season,Lockdown Zone: Level X Season 2,Kankin Kuiki Level X 2nd Season,https://s4.anilist.co/file/anilistcdn/media/anime/cover/medium/bx182877-In2sD6eEJdvw.png
173333,57827.0,Mashin Souzouden Wataru,MASHIN CREATOR WATARU,Mashin Souzouden Wataru,https://s4.anilist.co/file/anilistcdn/media/anime/cover/medium/bx173333-lqvM2Ya74nN9.jpg
186207,60782.0,Itsuka no Watashi yori,,Itsuka no Watashi yori,https://s4.anilist.co/file/anilistcdn/media/anime/cover/medium/bx186207-wXRSveC72nUP.png
185779,61353.0,Hametsu no Yuuwaku,,Hametsu no Yuuwaku,https://s4.anilist.co/file/anilistcdn/media/anime/cover/medium/bx185779-uzQoDrD3Sy6r.png
176432,,Thunderbolt Fantasy: Touriken Yuuki - Saishuushou,Thunderbolt Fantasy Sword Seekers -The Finale-,Thunderbolt Fantasy: Touriken Yuuki - Saishuushou,https://s4.anilist.co/file/anilistcdn/media/anime/cover/medium/bx176432-jqq2IZrjYaiZ.jpg
185648,60537.0,Monpoké,,Monpoké,https://s4.anilist.co/file/anilistcdn/media/anime/cover/medium/bx185648-NLFMKByKkNKx.png
185612,60045.0,The iDOLM@STER: Shiny Colors 2nd season - SHHis,,The iDOLM@STER: Shiny Colors 2nd season - SHHis,https://s4.anilist.co/file/anilistcdn/media/anime/cover/medium/bx185612-k7OiD1ocpHMC.png
192928,61327.0,Nomo no Kuni,The Land of NOMO,Nomo no Kuni,https://s4.anilist.co/file/anilistcdn/media/anime/cover/medium/bx192928-akbttQVo3Mdi.png
189893,60984.0,Sora-iro Utility × BIRDIE WING: Golf Girls' Story Mini Anime,,Sora-iro Utility × BIRDIE WING: Golf Girls' Story Mini Anime,https://s4.anilist.co/file/anilistcdn/media/anime/cover/medium/bx189893-7T1pZjLbwEie.png
184824,60642.0,Yuusha-chan no Bouken wa Owatte Shimatta!,,Yuusha-chan no Bouken wa Owatte Shimatta!,https://s4.anilist.co/file/anilistcdn/media/anime/cover/medium/bx184824-UcbgUai3o3xd.png
187514,61151.0,"Let's Roll, Cinnamoroll!","Let's Roll, Cinnamoroll!","Let's Roll, Cinnamoroll!",https://s4.anilist.co/file/anilistcdn/media/anime/cover/medium/bx187514-NvIkv0KVoYBF.jpg
187507,59458.0,Duel Masters LOST: Gekka no Shinigami,,Duel Masters LOST: Gekka no Shinigami,https://s4.anilist.co/file/anilistcdn/media/anime/cover/medium/bx187507-QqJ6HlOm65Iy.png
185901,61040.0,TRUST,,TRUST,https://s4.anilist.co/file/anilistcdn/media/anime/cover/medium/bx185901-iRIID6SJ3ugs.png
185900,61039.0,Hoshi no Kodomo to Hajimari no Ki,,Hoshi no Kodomo to Hajimari no Ki,https://s4.anilist.co/file/anilistcdn/media/anime/cover/medium/bx185900-c5hOndo2zcNd.png
185898,61038.0,Galaxy Apartment★Cosmo Hills,,Galaxy Apartment★Cosmo Hills,https://s4.anilist.co/file/anilistcdn/media/anime/cover/medium/bx185898-NnuSreMijs7g.png
185539,61016.0,Alps no Roujin Heidi no Ojii-san,,Alps no Roujin Heidi no Ojii-san,https://s4.anilist.co/file/anilistcdn/media/anime/cover/medium/bx185539-57P8xM9whe1b.png
185903,61041.0,DIVE IN!,,DIVE IN!,https://s4.anilist.co/file/anilistcdn/media/anime/cover/medium/bx185903-sTZFMXJGnwu4.png
185643,60613.0,Oshiri Tantei: STAR AND MOON,,Oshiri Tantei: STAR AND MOON,https://s4.anilist.co/file/anilistcdn/media/anime/cover/medium/b185643-GdoqcxGGXqq5.png
183412,56335.0,Shimajirou: Shimajirou to Yuuki no Uta,,Shimajirou: Shimajirou to Yuuki no Uta,https://s4.anilist.co/file/anilistcdn/media/anime/cover/medium/bx183412-aquaVDg24IRw.png
189733,61197.0,Haai! Myakumyaku desu,,Haai! Myakumyaku desu,https://s4.anilist.co/file/anilistcdn/media/anime/cover/medium/bx189733-PgwNxBPV1BSA.jpg
206071,61183.0,Futsuu no Seikatsu,,Futsuu no Seikatsu,https://s4.anilist.co/file/anilistcdn/media/anime/cover/medium/bx206071-vzOH2H4EPxFn.jpg
149118,51818.0,Enen no Shouboutai: San no Shou,Fire Force Season 3,Enen no Shouboutai: San no Shou,https://s4.anilist.co/file/anilistcdn/media/anime/cover/medium/bx149118-AOQb0xuTssGl.jpg
167336,56038.0,Lazarus,LAZARUS,Lazarus,https://s4.anilist.co/file/anilistcdn/media/anime/cover/medium/bx167336-KpGIIBie71OX.png
178680,59160.0,WIND BREAKER Season 2,WIND BREAKER Season 2,WIND BREAKER Season 2,https://s4.anilist.co/file/anilistcdn/media/anime/cover/medium/bx178680-nIAhCizY46ZU.jpg
180367,59597.0,Witch Watch,WITCH WATCH,Witch Watch,https://s4.anilist.co/file/anilistcdn/media/anime/cover/medium/bx180367-GlRuB2lG7Kaa.jpg
183161,60146.0,"Saikyou no Ousama, Nidome no Jinsei wa Nani wo Suru?",The Beginning After the End,"Saikyou no Ousama, Nidome no Jinsei wa Nani wo Suru?",https://s4.anilist.co/file/anilistcdn/media/anime/cover/medium/bx183161-5M054tuPmZJX.jpg
179955,59452.0,"Katainaka no Ossan, Kensei ni Naru",From Old Country Bumpkin to Master Swordsman,"Katainaka no Ossan, Kensei ni Naru",https://s4.anilist.co/file/anilistcdn/media/anime/cover/medium/bx179955-e4UPTow92B1O.jpg
185736,60593.0,Vigilante: Boku no Hero Academia ILLEGALS,My Hero Academia: Vigilantes,Vigilante: Boku no Hero Academia ILLEGALS,https://s4.anilist.co/file/anilistcdn/media/anime/cover/medium/bx185736-Ci6AiGwjKKtp.jpg
175872,58359.0,"Isshun de Chiryou Shiteita no ni Yakutatazu to Tsuihou Sareta Tensai Chiyushi, Yami Healer Toshite Tanoshiku Ikiru",The Brilliant Healer's New Life in the Shadows,"Isshun de Chiryou Shiteita no ni Yakutatazu to Tsuihou Sareta Tensai Chiyushi, Yami Healer Toshite Tanoshiku Ikiru",https://s4.anilist.co/file/anilistcdn/media/anime/cover/medium/bx175872-d55nfiC4WWHO.jpg
182814,60083.0,Kowloon Generic Romance,KOWLOON GENERIC ROMANCE,Kowloon Generic Romance,https://s4.anilist.co/file/anilistcdn/media/anime/cover/medium/bx182814-UTKRUUm7Jah5.jpg
153554,52709.0,"Danjo no Yuujou wa Seiritsu suru? (Iya, Shinai!!)",Can a Boy-Girl Friendship Survive?,"Danjo no Yuujou wa Seiritsu suru? (Iya, Shinai!!)",https://s4.anilist.co/file/anilistcdn/media/anime/cover/medium/bx153554-hHYe9aV6Gvlv.jpg
143598,49778.0,Kijin Gentoushou,Sword of the Demon Hunter: Kijin Gentosho,Kijin Gentoushou,https://s4.anilist.co/file/anilistcdn/media/anime/cover/medium/bx143598-FCvAhQJLllSP.png
179965,59457.0,"Haite Kudasai, Takamine-san","Please Put Them On, Takamine-san","Haite Kudasai, Takamine-san",https://s4.anilist.co/file/anilistcdn/media/anime/cover/medium/bx179965-EwqzG3xSyxwc.jpg
174802,58131.0,Shiunji-ke no Kodomotachi,The Shiunji Family Children,Shiunji-ke no Kodomotachi,https://s4.anilist.co/file/anilistcdn/media/anime/cover/medium/bx174802-ILahIZlNWN3R.jpg
143337,50738.0,"Slime Taoshite 300-nen, Shiranai Uchi ni Level MAX ni Nattemashita: Sono ni",I've Been Killing Slimes For 300 Years And Maxed Out My Level Season 2,"Slime Taoshite 300-nen, Shiranai Uchi ni Level MAX ni Nattemashita: Sono ni",https://s4.anilist.co/file/anilistcdn/media/anime/cover/medium/bx143337-2uPE0ywVcz9X.jpg
180516,59636.0,Uma Musume: Cinderella Gray,Umamusume: Cinderella Gray,Uma Musume: Cinderella Gray,https://s4.anilist.co/file/anilistcdn/media/anime/cover/medium/bx180516-xbd4Zpx6t6G6.png
183133,60140.0,"Kanchigai no Atelier Meister: Eiyuu Party no Moto Zatsuyougakari ga, Jitsu wa Sentou Igai ga SSS Rank Datta to Iu Yoku Aru Hanashi",The Unaware Atelier Meister,"Kanchigai no Atelier Meister: Eiyuu Party no Moto Zatsuyougakari ga, Jitsu wa Sentou Igai ga SSS Rank Datta to Iu Yoku Aru Hanashi",https://s4.anilist.co/file/anilistcdn/media/anime/cover/medium/bx183133-SSeg5j1UrMDG.png
181244,59833.0,Kono Subarashii Sekai ni Shukufuku wo! 3: BONUS STAGE,KONOSUBA -God's Blessing on This Wonderful World! 3 -BONUS STAGE-,Kono Subarashii Sekai ni Shukufuku wo! 3: BONUS STAGE,https://s4.anilist.co/file/anilistcdn/media/anime/cover/medium/bx181244-ICHU0FzIhEAY.jpg
179694,59360.0,Rock wa Lady no Tashinami Deshite,Rock is a Lady’s Modesty,Rock wa Lady no Tashinami Deshite,https://s4.anilist.co/file/anilistcdn/media/anime/cover/medium/bx179694-7zhc0T6IImor.jpg
183274,60154.0,Ore wa Seikan Kokka no Akutoku Ryoushu! ,I'm the Evil Lord of an Intergalactic Empire!,Ore wa Seikan Kokka no Akutoku Ryoushu! ,https://s4.anilist.co/file/anilistcdn/media/anime/cover/medium/bx183274-zqrwevS4PBJF.jpg
