anime_id,mal_id,title,english_title,user_preferred_title,cover_image_large
176509,58573.0,BAKI-DOU,BAKI-DOU: The Invincible Samurai,BAKI-DOU,https://s4.anilist.co/file/anilistcdn/media/anime/cover/medium/bx176509-GRUa4fzyAM9u.jpg
183984,60255.0,Arne no Jikenbo,The Case Book of Arne,Arne no Jikenbo,https://s4.anilist.co/file/anilistcdn/media/anime/cover/medium/bx183984-uq5scAXrhEdx.jpg
197731,61886.0,Goumon Baito-kun no Nichijou,The Daily Life of a Part-time Torturer,Goumon Baito-kun no Nichijou,https://s4.anilist.co/file/anilistcdn/media/anime/cover/medium/bx197731-6E0qjPFaNjC6.jpg
113971,38716.0,Kidou Senshi Gundam: Senkou no Hathaway - Circe no Majo,MOBILE SUIT GUNDAM HATHAWAY The Sorcery of Nymph Circe,Kidou Senshi Gundam: Senkou no Hathaway - Circe no Majo,https://s4.anilist.co/file/anilistcdn/media/anime/cover/medium/bx113971-y2wxyDYUqiHz.png
177132,58735.0,Hanarokushou ga Akeru Hi ni,,Hanarokushou ga Akeru Hi ni,https://s4.anilist.co/file/anilistcdn/media/anime/cover/medium/bx177132-V5P7e5f5OzNB.jpg
189137,61325.0,"Douse, Koishite Shimaunda. Season 2","Anyway, I'm Falling in Love with You. Season 2","Douse, Koishite Shimaunda. Season 2",https://s4.anilist.co/file/anilistcdn/media/anime/cover/medium/bx189137-cCXaEiX0bJb4.jpg
204270,63392.0,Evangelion: Housou 30 Shuunen Kinen Tokubetsu Kougyou,Evangelion 30th Anniversary Special Screening,Evangelion: Housou 30 Shuunen Kinen Tokubetsu Kougyou,https://s4.anilist.co/file/anilistcdn/media/anime/cover/medium/bx204270-6uMH5dFbyQPw.jpg
187062,61084.0,Hikuidori,Oedo Fire Slayer -The Legend of Phoenix-,Hikuidori,https://s4.anilist.co/file/anilistcdn/media/anime/cover/medium/bx187062-JuXPEjrLQSeO.png
197474,62277.0,Shin Gintama Movie: Yoshiwara Daienjou,,Shin Gintama Movie: Yoshiwara Daienjou,https://s4.anilist.co/file/anilistcdn/media/anime/cover/medium/bx197474-jTeY1G9gtD8i.jpg
202957,63042.0,Meitantei Precure!,Star Detective Precure!,Meitantei Precure!,https://s4.anilist.co/file/anilistcdn/media/anime/cover/medium/bx202957-fxZGgJTvwXzP.jpg
194318,61830.0,Yoroi Shinden Samurai Troopers,Yoroi-Shinden Samurai Troopers,Yoroi Shinden Samurai Troopers,https://s4.anilist.co/file/anilistcdn/media/anime/cover/medium/bx194318-V3STmm4wutVQ.jpg
197097,62193.0,Paris ni Saku Étoile,,Paris ni Saku Étoile,https://s4.anilist.co/file/anilistcdn/media/anime/cover/medium/bx197097-adHgYO4T73vA.jpg
191967,61608.0,Jigoku Sensei Nube (2025) Part 2,Hell Teacher: Jigoku Sensei Nube (2025) Part 2,Jigoku Sensei Nube (2025) Part 2,https://s4.anilist.co/file/anilistcdn/media/anime/cover/medium/bx191967-fLWqssc0gPI4.jpg
189258,61333.0,Ao no Miburo: Serizawa Ansatsu-hen,Blue Miburo Season 2,Ao no Miburo: Serizawa Ansatsu-hen,https://s4.anilist.co/file/anilistcdn/media/anime/cover/medium/bx189258-qhtrra5ebBm6.jpg
189956,61418.0,Kusunoki no Bannin,,Kusunoki no Bannin,https://s4.anilist.co/file/anilistcdn/media/anime/cover/medium/bx189956-6CFMaDqxTTNl.jpg
188034,61227.0,Girls und Panzer: Motto Love Love Sakusen desu!,,Girls und Panzer: Motto Love Love Sakusen desu!,https://s4.anilist.co/file/anilistcdn/media/anime/cover/medium/bx188034-hlwafdUZhjwD.png
198767,62897.0,Ichigo Aika: Zatsu de Namaiki na Imouto to Warikirenai Ani,Ichigo Aika: Strawberry Elegy,Ichigo Aika: Zatsu de Namaiki na Imouto to Warikirenai Ani,https://s4.anilist.co/file/anilistcdn/media/anime/cover/medium/bx198767-PoG84HHFXTit.jpg
195384,61964.0,Meikyuu no Shiori,LABYRINTH,Meikyuu no Shiori,https://s4.anilist.co/file/anilistcdn/media/anime/cover/medium/bx195384-mi810JewTu08.jpg
208517,63330.0,Android wa Keiken Ninzuu ni Hairimasu ka??: 5-kakan Tsuzukete......?,Does it Count if You Lose Your Innocence to an Android?: Five Days Running...?,Android wa Keiken Ninzuu ni Hairimasu ka??: 5-kakan Tsuzukete......?,https://s4.anilist.co/file/anilistcdn/media/anime/cover/medium/bx208517-cKokYKZaiCKw.jpg
199446,61969.0,"Saioshi no Gikei Mederu Tame, Nagaikishimasu!",I'll Live a Long Life to Dote on My Favorite Stepbrother!,"Saioshi no Gikei Mederu Tame, Nagaikishimasu!",https://s4.anilist.co/file/anilistcdn/media/anime/cover/medium/bx199446-2jYnGrTItjyu.jpg
206425,,Sousou no Frieren: ●● no Mahou Part 3,,Sousou no Frieren: ●● no Mahou Part 3,https://s4.anilist.co/file/anilistcdn/media/anime/cover/medium/b206425-WOwXsfDbHZwb.jpg
200556,62804.0,High School! Kimengumi (2026),High School! Kimengumi (2026),High School! Kimengumi (2026),https://s4.anilist.co/file/anilistcdn/media/anime/cover/medium/bx200556-TezRfCQCFLbA.png
204949,62518.0,Ginga Tokkyuu Milky☆Subway: Kakueki Teisha Gekijou Iki,,Ginga Tokkyuu Milky☆Subway: Kakueki Teisha Gekijou Iki,https://s4.anilist.co/file/anilistcdn/media/anime/cover/medium/bx204949-aLHdk5zHtnXv.jpg
184280,60294.0,Tensui no Sakuna-hime: Kokorowa Inasaku Nisshi,Sakuna: Of Rice and Ruin Kokorowa Rice Cultivation Diary,Tensui no Sakuna-hime: Kokorowa Inasaku Nisshi,https://s4.anilist.co/file/anilistcdn/media/anime/cover/medium/bx184280-FA1sWge8Wp5b.jpg
202419,62864.0,Omae wa Mada Gunma wo Shiranai: Reiwa-ban,You don't know Gunma yet.: Reiwa version,Omae wa Mada Gunma wo Shiranai: Reiwa-ban,https://s4.anilist.co/file/anilistcdn/media/anime/cover/medium/bx202419-BmPPSzsegbcv.png
203127,63504.0,Princess Principal: Crown Handler - Chapter 4: Fabulous Platypus,,Princess Principal: Crown Handler - Chapter 4: Fabulous Platypus,https://s4.anilist.co/file/anilistcdn/media/anime/cover/medium/bx203127-cJqnhI0w5WEk.png
207084,63396.0,Onee-chan Gokko,Playing Sister,Onee-chan Gokko,https://s4.anilist.co/file/anilistcdn/media/anime/cover/medium/b207084-5ERIoIDjU76C.jpg
204432,,CHOPPER's,,CHOPPER's,https://s4.anilist.co/file/anilistcdn/media/anime/cover/medium/bx204432-h8U4bVnSU6bM.png
203939,63087.0,Yami Shibai 16,Theatre of Darkness: Yamishibai 16,Yami Shibai 16,https://s4.anilist.co/file/anilistcdn/media/anime/cover/medium/bx203939-F8YG2X9LgfAX.png
198720,62987.0,Hokuto no Ken: Kenou-gun Zako-tachi no Banka,,Hokuto no Ken: Kenou-gun Zako-tachi no Banka,https://s4.anilist.co/file/anilistcdn/media/anime/cover/medium/bx198720-khTq51fpDDUZ.jpg
203296,62649.0,Cardfight!! Vanguard: Divinez - Genma Seisen-hen,CARDFIGHT!! VANGUARD Divinez Parallactic Clash,Cardfight!! Vanguard: Divinez - Genma Seisen-hen,https://s4.anilist.co/file/anilistcdn/media/anime/cover/medium/bx203296-LYXWSdP4N4YF.jpg
198511,62686.0,Seifuku wa Kita mama de,,Seifuku wa Kita mama de,https://s4.anilist.co/file/anilistcdn/media/anime/cover/medium/bx198511-R3bEhSgsbCxr.png
199005,62521.0,#Kanagawa ni Sunderu Elf,Kanagawa Elves,#Kanagawa ni Sunderu Elf,https://s4.anilist.co/file/anilistcdn/media/anime/cover/medium/bx199005-64XpgeaCMfir.jpg
204656,63151.0,mofusand,,mofusand,https://s4.anilist.co/file/anilistcdn/media/anime/cover/medium/b204656-KXjxVB4bBhl8.jpg
189259,63096.0,Arisugawa Ren tte Honto wa Onna Nanda yo ne.,Ren Arisugawa Is Actually a Girl,Arisugawa Ren tte Honto wa Onna Nanda yo ne.,https://s4.anilist.co/file/anilistcdn/media/anime/cover/medium/bx189259-vXGvEI1QcJS0.png
187375,61156.0,"THE IDOLM@STER Million Live!: Itsuka, Mannaka de",,"THE IDOLM@STER Million Live!: Itsuka, Mannaka de",https://s4.anilist.co/file/anilistcdn/media/anime/cover/medium/bx187375-0Vquhap6D5zX.jpg
203367,63074.0,"Mou Ichido, Shitemitai.",,"Mou Ichido, Shitemitai.",https://s4.anilist.co/file/anilistcdn/media/anime/cover/medium/bx203367-4TejHeBRRVYu.png
198368,62508.0,Doraemon: Shin Nobita no Kaitei Kiganjou,,Doraemon: Shin Nobita no Kaitei Kiganjou,https://s4.anilist.co/file/anilistcdn/media/anime/cover/medium/bx198368-uQ4yo55q9teU.jpg
187508,61119.0,Duel Masters LOST: Boukyaku no Taiyou,,Duel Masters LOST: Boukyaku no Taiyou,https://s4.anilist.co/file/anilistcdn/media/anime/cover/medium/bx187508-kFWf3Fq0wl56.png
202894,63026.0,Kenki Virgo,,Kenki Virgo,https://s4.anilist.co/file/anilistcdn/media/anime/cover/medium/bx202894-vv6EPa1MKCmD.png
206915,,Kegareboshi Murasaki,,Kegareboshi Murasaki,https://s4.anilist.co/file/anilistcdn/media/anime/cover/medium/bx206915-e41ZMPyvF3RA.png
206916,,Kegareboshi Kuro,,Kegareboshi Kuro,https://s4.anilist.co/file/anilistcdn/media/anime/cover/medium/bx206916-fXU6ZIYPO4Q5.png
201153,63084.0,Seikou Senki Pony Celes,,Seikou Senki Pony Celes,https://s4.anilist.co/file/anilistcdn/media/anime/cover/medium/bx201153-9xwz47bJi3wp.png
202893,63027.0,L'amour fou de l'automate,,L'amour fou de l'automate,https://s4.anilist.co/file/anilistcdn/media/anime/cover/medium/bx202893-z1PqTjt3fvEm.png
204463,63158.0,Hebi to Kumo,,Hebi to Kumo,https://s4.anilist.co/file/anilistcdn/media/anime/cover/medium/bx204463-2QQfFwEZL77K.png
203148,63106.0,Hoppe-chan: Sun Oukoku to Kuro Hoppe-dan no Himitsu,,Hoppe-chan: Sun Oukoku to Kuro Hoppe-dan no Himitsu,https://s4.anilist.co/file/anilistcdn/media/anime/cover/medium/bx203148-fMhz9uyA6HEK.jpg
204560,63232.0,Phantom Alchemia: Sylvia no Dokidoki Sakusei Toshi Keikaku,,Phantom Alchemia: Sylvia no Dokidoki Sakusei Toshi Keikaku,https://s4.anilist.co/file/anilistcdn/media/anime/cover/medium/bx204560-p9A5TzVb3mB1.png
205676,63275.0,Black Jack Yanen,,Black Jack Yanen,https://s4.anilist.co/file/anilistcdn/media/anime/cover/medium/bx205676-VlzcdwHYdJCe.png
206857,62690.0,Oshirimae Man: Fukkatsu no Oshirimae Teikoku,,Oshirimae Man: Fukkatsu no Oshirimae Teikoku,https://s4.anilist.co/file/anilistcdn/media/anime/cover/medium/bx206857-as3nDbOyIu7t.png
204698,63216.0,GelPiyo,,GelPiyo,https://s4.anilist.co/file/anilistcdn/media/anime/cover/medium/bx204698-6v7aAq92mKFl.png
208105,,Yani Neko Mini,,Yani Neko Mini,https://s4.anilist.co/file/anilistcdn/media/anime/cover/medium/b208105-pYHSBy6n9naY.png
203472,63200.0,Himitsu Kessha Taka no Tsume XX,,Himitsu Kessha Taka no Tsume XX,https://s4.anilist.co/file/anilistcdn/media/anime/cover/medium/bx203472-MJDpus1DWo3Z.png
147105,51553.0,Tongari Boushi no Atelier,Witch Hat Atelier,Tongari Boushi no Atelier,https://s4.anilist.co/file/anilistcdn/media/anime/cover/medium/bx147105-ACi2emlnHKSC.png
189046,61316.0,Re:Zero kara Hajimeru Isekai Seikatsu 4th Season,Re:ZERO -Starting Life in Another World- Season 4,Re:Zero kara Hajimeru Isekai Seikatsu 4th Season,https://s4.anilist.co/file/anilistcdn/media/anime/cover/medium/bx189046-yaHWtS5FII46.jpg
182205,59970.0,Tensei Shitara Slime Datta Ken 4th Season,That Time I Got Reincarnated as a Slime Season 4,Tensei Shitara Slime Datta Ken 4th Season,https://s4.anilist.co/file/anilistcdn/media/anime/cover/medium/bx182205-q2AeO1owuQbO.jpg
180745,59708.0,Youkoso Jitsuryoku Shijou Shugi no Kyoushitsu e 4th Season 2-nensei-hen Ichi Gakki,"Classroom of the Elite 4th Season: Second Year, First Semester",Youkoso Jitsuryoku Shijou Shugi no Kyoushitsu e 4th Season 2-nensei-hen Ichi Gakki,https://s4.anilist.co/file/anilistcdn/media/anime/cover/medium/bx180745-gzYdIqyfCqrD.png
182300,59983.0,Tsue to Tsurugi no Wistoria Season 2,Wistoria: Wand and Sword Season 2,Tsue to Tsurugi no Wistoria Season 2,https://s4.anilist.co/file/anilistcdn/media/anime/cover/medium/bx182300-EN7KwesPORVT.jpg
170019,56876.0,Otonari no Tenshi-sama ni Itsunomanika Dame Ningen ni Sareteita Ken 2nd Season,The Angel Next Door Spoils Me Rotten 2,Otonari no Tenshi-sama ni Itsunomanika Dame Ningen ni Sareteita Ken 2nd Season,https://s4.anilist.co/file/anilistcdn/media/anime/cover/medium/bx170019-PuiHMD1lpUJv.png
199221,62568.0,Dr. STONE: SCIENCE FUTURE Part 3,Dr. STONE SCIENCE FUTURE Cour 3,Dr. STONE: SCIENCE FUTURE Part 3,https://s4.anilist.co/file/anilistcdn/media/anime/cover/medium/bx199221-TReDQMNhslHu.jpg
195600,62001.0,Yomi no Tsugai,Daemons of the Shadow Realm,Yomi no Tsugai,https://s4.anilist.co/file/anilistcdn/media/anime/cover/medium/bx195600-moI0UFArtOme.jpg
173172,57779.0,Dorohedoro Season 2,Dorohedoro Season 2,Dorohedoro Season 2,https://s4.anilist.co/file/anilistcdn/media/anime/cover/medium/bx173172-404XnuOS0DhR.jpg
194317,61831.0,"Saikyou no Ousama, Nidome no Jinsei wa Nani wo Suru? 2nd Season",The Beginning After the End Season 2,"Saikyou no Ousama, Nidome no Jinsei wa Nani wo Suru? 2nd Season",https://s4.anilist.co/file/anilistcdn/media/anime/cover/medium/bx194317-FxQ1HysOYsLF.jpg
171110,57466.0,Honzuki no Gekokujou: Ryoushu no Youjo,Ascendance of a Bookworm: Adopted Daughter of an Archduke,Honzuki no Gekokujou: Ryoushu no Youjo,https://s4.anilist.co/file/anilistcdn/media/anime/cover/medium/bx171110-7zOdInS6DQNL.jpg
184492,60310.0,Mairimashita! Iruma-kun 4,Welcome to Demon School! Iruma-kun Season 4,Mairimashita! Iruma-kun 4,https://s4.anilist.co/file/anilistcdn/media/anime/cover/medium/bx184492-KUVFGieuMaOx.jpg
204356,63130.0,Boku no Hero Academia No. 170+1: More,My Hero Academia Special Episode “More”,Boku no Hero Academia No. 170+1: More,https://s4.anilist.co/file/anilistcdn/media/anime/cover/medium/b204356-XJ4mZRKtVydW.png
199547,62601.0,MARRIAGETOXIN,MARRIAGETOXIN,MARRIAGETOXIN,https://s4.anilist.co/file/anilistcdn/media/anime/cover/medium/bx199547-LAaG3cmKCGhr.jpg
169580,56734.0,Class de 2-banme ni Kawaii Onnanoko to Tomodachi ni Natta,I Made Friends with the Second Prettiest Girl in My Class,Class de 2-banme ni Kawaii Onnanoko to Tomodachi ni Natta,https://s4.anilist.co/file/anilistcdn/media/anime/cover/medium/bx169580-nXxpmqu6UVux.jpg
197824,62146.0,Isekai Nonbiri Nouka 2,Farming Life in Another World 2,Isekai Nonbiri Nouka 2,https://s4.anilist.co/file/anilistcdn/media/anime/cover/medium/bx197824-Fclt06L5Ht2r.jpg
197754,62331.0,LIAR GAME,LIAR GAME,LIAR GAME,https://s4.anilist.co/file/anilistcdn/media/anime/cover/medium/bx197754-Q5KqcUhIdypp.png
190143,61443.0,Shunkashuutou Daikousha: Haru no Mai,Agents of the Four Seasons: Dance of Spring,Shunkashuutou Daikousha: Haru no Mai,https://s4.anilist.co/file/anilistcdn/media/anime/cover/medium/bx190143-UV3GarNkmbMi.jpg
182483,60028.0,Hime Kishi wa Barbaroi no Yome,The Warrior Princess and the Barbaric King,Hime Kishi wa Barbaroi no Yome,https://s4.anilist.co/file/anilistcdn/media/anime/cover/medium/bx182483-La7chs6htDWr.jpg
196935,62164.0,Akane-banashi,Akane-banashi,Akane-banashi,https://s4.anilist.co/file/anilistcdn/media/anime/cover/medium/bx196935-RnLWBsEvNp8M.jpg
202102,62913.0,NEEDY GIRL OVERDOSE,NEEDY GIRL OVERDOSE,NEEDY GIRL OVERDOSE,https://s4.anilist.co/file/anilistcdn/media/anime/cover/medium/bx202102-7qDmTI7eT5xF.png
194393,61839.0,Aishiteru Game wo Owarasetai,I Want to End this Love Game,Aishiteru Game wo Owarasetai,https://s4.anilist.co/file/anilistcdn/media/anime/cover/medium/bx194393-0H9yYABu6y0i.jpg
178707,59174.0,Mahouka Koukou no Rettousei: Yotsuba Keishou-hen,,Mahouka Koukou no Rettousei: Yotsuba Keishou-hen,https://s4.anilist.co/file/anilistcdn/media/anime/cover/medium/bx178707-Ys8zvR7BLECi.jpg
190704,61501.0,Kanan-sama wa Akumade Choroi,Mistress Kanan is Devilishly Easy,Kanan-sama wa Akumade Choroi,https://s4.anilist.co/file/anilistcdn/media/anime/cover/medium/bx190704-Ts1VvkrNdnCZ.jpg
179813,59393.0,Niwatori Fighter,Rooster Fighter,Niwatori Fighter,https://s4.anilist.co/file/anilistcdn/media/anime/cover/medium/bx179813-Bu6tvnVr6rEM.png
179950,59443.0,Reincarnation no Kaben,Petals of Reincarnation,Reincarnation no Kaben,https://s4.anilist.co/file/anilistcdn/media/anime/cover/medium/bx179950-g95odyBfYEbU.jpg
199588,62604.0,Otaku ni Yasashii Gal wa Inai!?,Gals Can't Be Kind to Otaku!?,Otaku ni Yasashii Gal wa Inai!?,https://s4.anilist.co/file/anilistcdn/media/anime/cover/medium/bx199588-swWolWwf5mZx.png
180228,59551.0,Ganbare! Nakamura-kun!!,"Go For It, Nakamura-kun!!",Ganbare! Nakamura-kun!!,https://s4.anilist.co/file/anilistcdn/media/anime/cover/medium/bx180228-vNwpaK5X7osA.png
182578,60055.0,Yozakura-san Chi no Daisakusen 2nd Season,,Yozakura-san Chi no Daisakusen 2nd Season,https://s4.anilist.co/file/anilistcdn/media/anime/cover/medium/bx182578-Te8W0EwesgrS.jpg
186497,60852.0,Koori no Jouheki,The Ramparts of Ice,Koori no Jouheki,https://s4.anilist.co/file/anilistcdn/media/anime/cover/medium/bx186497-uwPrNPphXvjP.jpg
199029,62485.0,"Kanojo, Okarishimasu 5th Season",Rent-a-Girlfriend Season 5,"Kanojo, Okarishimasu 5th Season",https://s4.anilist.co/file/anilistcdn/media/anime/cover/medium/bx199029-RGOUJulG9Jic.png
195268,61931.0,Higeki no Genkyou to Naru Saikyou Gedou Last Boss Joou wa Tami no Tame ni Tsukushimasu.  Season 2,The Most Heretical Last Boss Queen: From Villainess to Savior Season 2,Higeki no Genkyou to Naru Saikyou Gedou Last Boss Joou wa Tami no Tame ni Tsukushimasu.  Season 2,https://s4.anilist.co/file/anilistcdn/media/anime/cover/medium/bx195268-HkEv0z9iTCJK.jpg
187869,61186.0,"Kamiina Botan, Yoeru Sugata wa Yuri no Hana",Botan Kamiina Fully Blossoms When Drunk,"Kamiina Botan, Yoeru Sugata wa Yuri no Hana",https://s4.anilist.co/file/anilistcdn/media/anime/cover/medium/bx187869-LUn3dyTzuKUq.jpg
185211,60444.0,Yowa Yowa Sensei,Yowayowa Sensei,Yowa Yowa Sensei,https://s4.anilist.co/file/anilistcdn/media/anime/cover/medium/bx185211-ewfgT5Cn99k0.jpg
189987,61425.0,Ponkotsu Fuuki Iin to Skirt take ga Futekisetsu na JK no Hanashi,The Klutzy Class Monitor and the Girl with the Short Skirt,Ponkotsu Fuuki Iin to Skirt take ga Futekisetsu na JK no Hanashi,https://s4.anilist.co/file/anilistcdn/media/anime/cover/medium/bx189987-CkTDPfD7vu2Y.jpg
196012,62048.0,MAO,,MAO,https://s4.anilist.co/file/anilistcdn/media/anime/cover/medium/bx196012-kawFEw6XhYMh.jpg
192808,61687.0,Jishou Akuyaku Reijou na Konyakusha no Kansatsu Kiroku.,An Observation Log of My Fiancée Who Calls Herself a Villainess,Jishou Akuyaku Reijou na Konyakusha no Kansatsu Kiroku.,https://s4.anilist.co/file/anilistcdn/media/anime/cover/medium/bx192808-tfrX4Gn2Y1Ye.jpg
200769,62825.0,Saikyou no Shokugyou wa Yuusha demo Kenja demo Naku Kanteishi (Kari) Rashii desu yo?,"The strongest job is apparently not a hero or a sage, but an appraiser (provisional)!",Saikyou no Shokugyou wa Yuusha demo Kenja demo Naku Kanteishi (Kari) Rashii desu yo?,https://s4.anilist.co/file/anilistcdn/media/anime/cover/medium/bx200769-8WkFkoFxc2fw.jpg
177501,58820.0,Awajima Hyakkei,A Hundred Scenes of AWAJIMA,Awajima Hyakkei,https://s4.anilist.co/file/anilistcdn/media/anime/cover/medium/bx177501-lLkxUFVZ8uAj.jpg
188035,61230.0,Saishuu Gakushou Hibike! Euphonium - Zenpen,,Saishuu Gakushou Hibike! Euphonium - Zenpen,https://s4.anilist.co/file/anilistcdn/media/anime/cover/medium/bx188035-bYKPqQ8Ccvy5.png
196974,62171.0,Kuroneko to Majo no Kyoushitsu,,Kuroneko to Majo no Kyoushitsu,https://s4.anilist.co/file/anilistcdn/media/anime/cover/medium/bx196974-mZk1uyrx0XNx.png
198939,62512.0,Jidou Hanbaiki ni Umarekawatta Ore wa Meikyuu wo Samayou 3rd Season,"Reborn as a Vending Machine, I Now Wander the Dungeon Season 3",Jidou Hanbaiki ni Umarekawatta Ore wa Meikyuu wo Samayou 3rd Season,https://s4.anilist.co/file/anilistcdn/media/anime/cover/medium/bx198939-95aqzBr0Lzcv.jpg
195333,61943.0,Haibara-kun no Tsuyokute Seishun New Game,,Haibara-kun no Tsuyokute Seishun New Game,https://s4.anilist.co/file/anilistcdn/media/anime/cover/medium/bx195333-KUIF1eqOdVdd.png
186744,61013.0,"Replica Datte, Koi wo Suru.",Even a Replica Can Fall in Love,"Replica Datte, Koi wo Suru.",https://s4.anilist.co/file/anilistcdn/media/anime/cover/medium/bx186744-nFH4y2slUrO4.jpg
179874,61202.0,Mononoke: Hebigami,,Mononoke: Hebigami,https://s4.anilist.co/file/anilistcdn/media/anime/cover/medium/bx179874-JXaQoBDuaYlq.jpg
201817,62893.0,Nigashita Sakana wa Ookikatta ga Tsuriageta Sakana ga Ookisugita Ken,,Nigashita Sakana wa Ookikatta ga Tsuriageta Sakana ga Ookisugita Ken,https://s4.anilist.co/file/anilistcdn/media/anime/cover/medium/bx201817-pyfL9F8muPeq.jpg
177634,58877.0,Diamond no Ace act II: Second Season,,Diamond no Ace act II: Second Season,https://s4.anilist.co/file/anilistcdn/media/anime/cover/medium/bx177634-jYdKdbPOwWhR.png
202381,62964.0,"Mata Korosarete Shimatta no desu ne, Tantei-sama",,"Mata Korosarete Shimatta no desu ne, Tantei-sama",https://s4.anilist.co/file/anilistcdn/media/anime/cover/medium/bx202381-bxgyUXGtGtZj.jpg
206914,63375.0,Nippon Sangoku,NIPPON SANGOKU: The Three Nations of the Crimson Sun,Nippon Sangoku,https://s4.anilist.co/file/anilistcdn/media/anime/cover/medium/bx206914-SHKX08LarRzB.jpg
202523,62983.0,Marika-chan no Koukando wa Bukkowareteiru,Marika's Love Meter Malfunction,Marika-chan no Koukando wa Bukkowareteiru,https://s4.anilist.co/file/anilistcdn/media/anime/cover/medium/bx202523-NHeyiypiPnGP.jpg
198113,62391.0,Kill Ao,,Kill Ao,https://s4.anilist.co/file/anilistcdn/media/anime/cover/medium/bx198113-NRa47idWSlnx.jpg
197868,62342.0,Maid-san wa Taberu dake,The Food Diary of Miss Maid,Maid-san wa Taberu dake,https://s4.anilist.co/file/anilistcdn/media/anime/cover/medium/bx197868-sm5jcjPKWhNL.png
204319,63248.0,Ookii Onnanoko wa Suki desu ka?,Do You Like Big Girls?,Ookii Onnanoko wa Suki desu ka?,https://s4.anilist.co/file/anilistcdn/media/anime/cover/medium/bx204319-WCqofuPxOjqA.png
196029,62050.0,Kami no Niwatsuki Kusunoki-tei ,Kusunoki's Garden of Gods,Kami no Niwatsuki Kusunoki-tei ,https://s4.anilist.co/file/anilistcdn/media/anime/cover/medium/bx196029-4ML0UHngkZhn.jpg
195734,62018.0,Ichijouma Mankitsu Gurashi!,Ichijyoma Mankitsu Gurashi!,Ichijouma Mankitsu Gurashi!,https://s4.anilist.co/file/anilistcdn/media/anime/cover/medium/bx195734-submxAA36thQ.jpg
181284,59835.0,Kirio Fanclub,,Kirio Fanclub,https://s4.anilist.co/file/anilistcdn/media/anime/cover/medium/bx181284-JJafhd5gDT53.jpg
169228,56646.0,Hokuto no Ken: FIST OF THE NORTH STAR,FIST OF THE NORTH STAR: HOKUTO NO KEN,Hokuto no Ken: FIST OF THE NORTH STAR,https://s4.anilist.co/file/anilistcdn/media/anime/cover/medium/bx169228-4MsNkVygvkIs.jpg
158036,53732.0,Hidarikiki no Eren,Eren the Southpaw,Hidarikiki no Eren,https://s4.anilist.co/file/anilistcdn/media/anime/cover/medium/bx158036-KfXv0BFBUsWl.jpg
196144,62068.0,Snowball Earth,SNOWBALL EARTH,Snowball Earth,https://s4.anilist.co/file/anilistcdn/media/anime/cover/medium/bx196144-UqVOcMjThkqa.jpg
196840,62155.0,Iya na Kao sare nagara Opantsu Misete Moraitai Returns,,Iya na Kao sare nagara Opantsu Misete Moraitai Returns,https://s4.anilist.co/file/anilistcdn/media/anime/cover/medium/bx196840-9l084Fis4fYF.png
202985,63014.0,"Tadaima, Ojamasaremasu!",,"Tadaima, Ojamasaremasu!",https://s4.anilist.co/file/anilistcdn/media/anime/cover/medium/bx202985-WsJv1knJoRFL.jpg
208352,63572.0,Dandelion,Dandelion,Dandelion,https://s4.anilist.co/file/anilistcdn/media/anime/cover/medium/bx208352-E1rq91MSsQ6a.jpg
206951,63376.0,"Megami ""Isekai Tensei Nani ni Naritai Desu ka"" Ore ""Yuusha no Rokkotsu de""",,"Megami ""Isekai Tensei Nani ni Naritai Desu ka"" Ore ""Yuusha no Rokkotsu de""",https://s4.anilist.co/file/anilistcdn/media/anime/cover/medium/bx206951-qiHcrw7pwzuq.jpg
178749,59176.0,Mahou no Shimai Lulutto Lilly,,Mahou no Shimai Lulutto Lilly,https://s4.anilist.co/file/anilistcdn/media/anime/cover/medium/bx178749-c0tx9p13PVJy.png
177508,58832.0,Kujima Utaeba Ie Hororo,"Kujima: Why Sing, When You Can Warble?",Kujima Utaeba Ie Hororo,https://s4.anilist.co/file/anilistcdn/media/anime/cover/medium/bx177508-Wfbz6iF9LlP2.png
194167,61806.0,Love Live! Hasu no Sora Jogakuin School Idol Club: Bloom Garden Party,,Love Live! Hasu no Sora Jogakuin School Idol Club: Bloom Garden Party,https://s4.anilist.co/file/anilistcdn/media/anime/cover/medium/bx194167-kPUIZQFObAau.jpg
202508,62981.0,Kami no Shizuku,The Drops of God,Kami no Shizuku,https://s4.anilist.co/file/anilistcdn/media/anime/cover/medium/bx202508-dk6LEyevJYUY.jpg
206166,63310.0,Ingoku Danchi,,Ingoku Danchi,https://s4.anilist.co/file/anilistcdn/media/anime/cover/medium/bx206166-DBCWm9mAcBT8.jpg
201090,62852.0,Ghost Concert: missing Songs,GHOST CONCERT : missing Songs,Ghost Concert: missing Songs,https://s4.anilist.co/file/anilistcdn/media/anime/cover/medium/bx201090-HzQKUjjvde32.jpg
198369,62387.0,Meitantei Conan: Highway no Datenshi,,Meitantei Conan: Highway no Datenshi,https://s4.anilist.co/file/anilistcdn/media/anime/cover/medium/bx198369-SCQoqNEk325p.jpg
205054,,Tensei Akujo no Kuro Rekishi OVA,,Tensei Akujo no Kuro Rekishi OVA,https://s4.anilist.co/file/anilistcdn/media/anime/cover/medium/bx205054-yDlMfYNpj3M1.jpg
207675,63469.0,Hyakki Yakou Shou,,Hyakki Yakou Shou,https://s4.anilist.co/file/anilistcdn/media/anime/cover/medium/bx207675-h3TZK82jG5aD.png
183231,,Rilakkuma: Goyururi Yume no Tabi,,Rilakkuma: Goyururi Yume no Tabi,https://s4.anilist.co/file/anilistcdn/media/anime/cover/medium/bx183231-nqc56OPthHii.jpg
209312,,Girls und Panzer: Ribbon no Musha Pilot-ban,,Girls und Panzer: Ribbon no Musha Pilot-ban,https://s4.anilist.co/file/anilistcdn/media/anime/cover/medium/bx209312-ZQGohKvgqGP6.png
190668,61492.0,Entotsu-machi no Poupelle: Yakusoku no Tokei-dai,,Entotsu-machi no Poupelle: Yakusoku no Tokei-dai,https://s4.anilist.co/file/anilistcdn/media/anime/cover/medium/bx190668-8r3mK40eIm3E.png
204269,63125.0,Odekake Kozame Season 2,,Odekake Kozame Season 2,https://s4.anilist.co/file/anilistcdn/media/anime/cover/medium/bx204269-fTR4iyVjTHiC.png
206523,,Onegai AiPri,,Onegai AiPri,https://s4.anilist.co/file/anilistcdn/media/anime/cover/medium/bx206523-2IaJCk4R7i63.jpg
209940,63709.0,Komekami! Girls,,Komekami! Girls,https://s4.anilist.co/file/anilistcdn/media/anime/cover/medium/bx209940-wV4VrfO2c5dE.jpg
200930,63159.0,Anal Mania Otaku to Ananie Daisuki na Ojou-sama: Kiseki no Matching,,Anal Mania Otaku to Ananie Daisuki na Ojou-sama: Kiseki no Matching,https://s4.anilist.co/file/anilistcdn/media/anime/cover/medium/bx200930-LilV7nMGiVKm.png
205772,63276.0,Candy Caries,,Candy Caries,https://s4.anilist.co/file/anilistcdn/media/anime/cover/medium/bx205772-kb2YOaXFfPAB.png
208314,63582.0,Kyonyuu ga Futari Inai to Bokki Shinai Danna no Tame ni Tomodachi wo Tsurete Kita Tsuma,,Kyonyuu ga Futari Inai to Bokki Shinai Danna no Tame ni Tomodachi wo Tsurete Kita Tsuma,https://s4.anilist.co/file/anilistcdn/media/anime/cover/medium/bx208314-Lw3CFRCPkprM.png
